{
  "schema_version": 1,
  "id": "frozen-peaks",
  "name": "Frozen Peaks",
  "room_ids": [
    "frozen-peaks-foothills",
    "frozen-peaks-pass",
    "frozen-peaks-glacier",
    "frozen-peaks-ice-cavern",
    "frozen-peaks-ridge",
    "frozen-peaks-summit"
  ],
  "connections": [
    "darkwood",
    "emberdeep"
  ],
  "ascii_map": [
    "   /\\/\\  FROZEN PEAKS  /\\/\\",
    "",
    "        [Summit] --v-- Emberdeep",
    "           |",
    "        [Ridge]",
    "           |",
    "       [Glacier]---[Ice Cavern]",
    "           |",
    "         [Pass]",
    "           |",
    "       [Foothills]",
    "           |",
    "           v",
    "        Darkwood",
    "",
    "   Wind-scoured ice above the treeline."
  ]
}
